{
  "evaluated_at": "2026-02-26T04:15:48.781321Z",
  "judge_model": "gpt-4o",
  "judge_provider": "openai",
  "total_evaluations": 27,
  "evaluations": [
    {
      "question_id": "tbb-gs-01",
      "question_text": "How do I install oneTBB on Ubuntu and verify the installation?",
      "with_docs": {
        "correctness": 75,
        "completeness": 80,
        "specificity": 85,
        "code_quality": 80,
        "actionability": 85,
        "aggregate": 81,
        "reasoning": {
          "correctness": "Some details are missing or incorrect, such as the incorrect git repository URL for oneTBB.",
          "completeness": "Most necessary steps are included, but detailed verification steps or common troubleshooting tips could enhance it.",
          "specificity": "The answer focuses on oneTBB, mentioning specific instructions in its context.",
          "code_quality": "Code examples are mostly correct but assume a standard setup without addressing potential variations or errors.",
          "actionability": "Instructions are clear and actionable, enabling users to follow along effectively."
        }
      },
      "without_docs": {
        "correctness": 85,
        "completeness": 90,
        "specificity": 80,
        "code_quality": 85,
        "actionability": 90,
        "aggregate": 86,
        "reasoning": {
          "correctness": "The answer accurately describes the installation of oneTBB using multiple methods and includes a verification step, consistent with current installation practices.",
          "completeness": "The response is comprehensive, covering system preparation, installation, and multiple verification methods, but could mention potential troubleshooting steps.",
          "specificity": "The instructions are specific to installing oneTBB, though some steps like system update and building libraries are more general.",
          "code_quality": "The example code is correctly structured and should compile and run as intended, although using task-based TBB components directly might be more illustrative.",
          "actionability": "The guide is actionable, providing a clear, step-by-step approach that a user can immediately apply to install and verify oneTBB."
        }
      },
      "delta": -5
    },
    {
      "question_id": "tbb-gs-02",
      "question_text": "How do I parallelize a simple for-loop using oneTBB? Show a complete hello-world example.",
      "with_docs": {
        "correctness": 85,
        "completeness": 90,
        "specificity": 80,
        "code_quality": 85,
        "actionability": 90,
        "aggregate": 86,
        "reasoning": {
          "correctness": "The answer accurately demonstrates parallelizing a loop using oneTBB, but could be more rigorous in explaining some details like thread safety concerns or performance impacts.",
          "completeness": "The answer fully addresses the question with a complete example, including code, explanation, and compilation instructions.",
          "specificity": "The answer is specific to oneTBB as it uses the parallel_for function available in oneTBB.",
          "code_quality": "The code is mostly correct, compiles, and demonstrates the concept correctly, but it might miss some edge cases or more advanced usage scenarios.",
          "actionability": "The steps are clear and actionable, allowing the user to quickly apply the solution to a similar problem."
        }
      },
      "without_docs": {
        "correctness": 85,
        "completeness": 90,
        "specificity": 80,
        "code_quality": 85,
        "actionability": 90,
        "aggregate": 86,
        "reasoning": {
          "correctness": "The answer uses the correct oneTBB function and provides the expected parallel behavior for a loop. However, it assumes the correct setup and linking of the TBB library without further installation details.",
          "completeness": "It covers the necessary steps to parallelize a for-loop using oneTBB, including setup and explanation, but could enhance this by explaining the installation and environment configuration of oneTBB more extensively for beginners.",
          "specificity": "The response specifically uses the oneTBB library and its functions rather than generic parallelization strategies, but could delve deeper into the library's specifics.",
          "code_quality": "The code given is correct, functional, and well-structured but might benefit from additional comments and handling of potential multithreading issues, such as unordered printing due to `std::cout` usage in parallel. Proper use of TBB would involve more complex examples showcasing data handling.",
          "actionability": "The steps are clear and understandable, allowing users to adopt this pattern into their codebases quickly, assuming they have a baseline understanding of how to set up their environment correctly."
        }
      },
      "delta": 0
    },
    {
      "question_id": "tbb-gs-03",
      "question_text": "What are the basic building blocks of oneTBB? Explain the core concepts.",
      "with_docs": {
        "correctness": 90,
        "completeness": 85,
        "specificity": 95,
        "code_quality": 80,
        "actionability": 85,
        "aggregate": 87,
        "reasoning": {
          "correctness": "The answer correctly outlines the primary building blocks of oneTBB and explains parallel algorithms, task groups, flow graphs, task arena, and data structures effectively.",
          "completeness": "While it covers key concepts of oneTBB, the answer could explore some additional aspects like work stealing, load balancing, or synchronization support in more depth.",
          "specificity": "The answer is highly specific to oneTBB, detailing the specific APIs and components offered by oneTBB.",
          "code_quality": "The code examples illustrate usage correctly, but some details like error handling or edge cases in the examples could be more robust.",
          "actionability": "Provides clear examples and explanations that a user can follow to apply the concepts directly in their code."
        }
      },
      "without_docs": {
        "correctness": 80,
        "completeness": 85,
        "specificity": 85,
        "code_quality": 80,
        "actionability": 85,
        "aggregate": 83,
        "reasoning": {
          "correctness": "The answer is mostly accurate but contains outdated details. For example, `tbb::task_scheduler_init` is deprecated in recent versions of oneTBB.",
          "completeness": "The answer addresses the main components of oneTBB but lacks details about some modern features like heterogeneity support and recent changes in flow graph API.",
          "specificity": "Focuses well on oneTBB-specific components, APIs, and concepts.",
          "code_quality": "Some code snippets use deprecated or outdated constructs, though they are illustrative of concepts.",
          "actionability": "The provided codes and explanations would allow a user familiar with C++ to begin using oneTBB, though updates may be necessary for the latest versions."
        }
      },
      "delta": 4
    },
    {
      "question_id": "tbb-int-01",
      "question_text": "How do I integrate oneTBB with CMake? Show a complete CMakeLists.txt example.",
      "with_docs": {
        "correctness": 90,
        "completeness": 95,
        "specificity": 95,
        "code_quality": 90,
        "actionability": 95,
        "aggregate": 93,
        "reasoning": {
          "correctness": "Answer accurately uses the find_package and target_link_libraries commands for oneTBB, which should work as intended.",
          "completeness": "Includes all necessary parts of CMake setup for using oneTBB and provides an example of how to include OpenMP optionally, covering additional info the user may need.",
          "specificity": "Directly refers to integrating oneTBB using specific CMake commands associated with it.",
          "code_quality": "The CMake code is well-written, logical, and should run without issues when provided with correct inputs.",
          "actionability": "Gives clear instructions and commands that a user can immediately use to implement oneTBB in a CMake project."
        }
      },
      "without_docs": {
        "correctness": 85,
        "completeness": 90,
        "specificity": 80,
        "code_quality": 85,
        "actionability": 90,
        "aggregate": 86,
        "reasoning": {
          "correctness": "The answer provides a generally accurate method for integrating oneTBB with CMake, using the find_package and target_link_libraries functionalities correctly.",
          "completeness": "The response covers all necessary parts of integrating oneTBB, including setting up CMakeLists.txt and building the project.",
          "specificity": "The answer is focused on oneTBB, although the use of TBB::<component> specifically is mentioned as a potential improvement for specificity.",
          "code_quality": "The code provided should work for most use cases, assuming TBB is installed correctly, and follows modern CMake practices.",
          "actionability": "The user has clear, actionable steps to follow to integrate oneTBB, provided they've met the prerequisites (e.g., TBB installation)."
        }
      },
      "delta": 7
    },
    {
      "question_id": "tbb-int-02",
      "question_text": "How do I use oneTBB with conan package manager? Show the conanfile and integration.",
      "with_docs": {
        "correctness": 85,
        "completeness": 90,
        "specificity": 80,
        "code_quality": 85,
        "actionability": 90,
        "aggregate": 86,
        "reasoning": {
          "correctness": "The answer aligns well with documentation for using oneTBB and integrating it via Conan and CMake.",
          "completeness": "The answer provides a comprehensive guide, including a conanfile and CMake integration, along with build instructions.",